{
  "schema_version": 1,
  "mode": "example",
  "period": "Illustrative week",
  "last_week": [
    {
      "title": "Compare the options on the same basis",
      "detail": "A fictional PM named speed and ease of maintenance as competing goals, but compared two options using different criteria.",
      "evidence": "Invented observation E1: a planning note lists both goals; its comparison gives each option a different test.",
      "limit": "This is one invented discussion, not evidence of a lasting behavior pattern."
    }
  ],
  "assessment": [
    {
      "title": "Decision clarity",
      "detail": "Tentative interpretation: the tradeoff is clear, but the comparison is incomplete. Apply the same criteria to both options before making the choice.",
      "evidence": "Invented observation E1: competing goals were documented; comparison criteria were not shared.",
      "limit": "One discussion supports this narrow interpretation, not a rating of the person. Review further examples before changing an assessment."
    }
  ],
  "roadmap": [
    {
      "title": "Compare alternatives on one page",
      "detail": "Chosen for this example: compare both options against the same criteria in the next planning discussion. Progress check: a peer can explain why the preferred option fits the goal.",
      "evidence": "A fictional next practice based on observation E1; no result has happened yet.",
      "limit": "Record proposed or accepted status, the next occasion and the progress check in your own JSON after review."
    }
  ],
  "achievements": [
    {
      "title": "Drafted a decision brief",
      "detail": "Candidate \u00b7 Pending review. Personal contribution: drafted the comparison. Team contribution: reviewed the options. Stage: delivered; outcome and impact are still unknown.",
      "evidence": "Invented observation E1: a comparison draft exists.",
      "limit": "Delivery alone does not establish adoption or impact. Keep this candidate pending until you review the evidence."
    }
  ]
}
